time_uk,datetime_utc,company,ticker,category_code,category,headline,rns_number,news_id,last_price,pct_change,brief,summary,retail_take,sentiment,source_url
2026-07-22 07:00:04,2026-07-22T06:00:04.000,Frontier IP Group plc,FIPP,NRA,,Portfolio news: CRI wins EU grant,2892N,17699427,13.25,,,,,,
2026-07-22 07:00:04,2026-07-22T06:00:04.000,EPE Special Opportunities Limited,ESO,MSC,Miscellaneous,Amendment and Extension of Unsecured Loan Notes,2987N,17699426,233,,,,,,
2026-07-22 07:00:04,2026-07-22T06:00:04.000,Transense Technologies PLC,TRT,NRA,,Transense appoints distributors for Translogik,2860N,17699425,48.5,,,,,,
2026-07-22 07:00:04,2026-07-22T06:00:04.000,GreenX Metals Limited,GRX,MSC,Miscellaneous,2026 Fieldwork Underway at Eleonore North,3704N,17699424,47.5,,,,,,
2026-07-22 07:00:04,2026-07-22T06:00:04.000,Skillcast Group PLC,SKL,NOR,Notice of results,Trading Update and Notice of Interim Results  ,2986N,17699423,45,,,,,,
2026-07-22 07:00:04,2026-07-22T06:00:04.000,HgCapital Trust PLC,HGT,MSC,Miscellaneous,Hg announces an investment in Street Group ,2976N,17699422,380.0,,,,,,
2026-07-22 07:00:04,2026-07-22T06:00:04.000,Primary Health Properties PLC,PHP,NOR,Notice of results,Notice of Interim Results,2944N,17699421,94.05,,,,,,
2026-07-22 07:00:04,2026-07-22T06:00:04.000,Fermi Inc.,FRMI,NRA,,First Siemens Turbines Arrive at Port of Houston,2973N,17699429,6.62,,,,,,
2026-07-22 07:00:03,2026-07-22T06:00:03.000,DP Poland PLC,DPP,DSH,Director/PDMR shareholding,Director/PDMR Shareholding,2945N,17699399,6.85,,,,,,
2026-07-22 07:00:03,2026-07-22T06:00:03.000,First Class Metals PLC,FCM,DSH,Director/PDMR shareholding,Exercise of Share Options,2967N,17699400,2.65,,,,,,
2026-07-22 07:00:03,2026-07-22T06:00:03.000,One Health Group PLC,OHGR,DSH,Director/PDMR shareholding,Director share purchase,2968N,17699401,248.5,,,,,,
2026-07-22 07:00:03,2026-07-22T06:00:03.000,Technology Minerals PLC,TM1,BOA,Board appointment/change,Board Appointments,2926N,17699398,0.0475,,,,,,
2026-07-22 07:00:03,2026-07-22T06:00:03.000,Potter & Moore PLC,PAM,BOA,Board appointment/change,CFO Resignation ,2914N,17699397,23,,,,,,
2026-07-22 07:00:03,2026-07-22T06:00:03.000,Pets At Home Group Plc,PETS,DSH,Director/PDMR shareholding,Director/PDMR Shareholding,2882N,17699396,198.5,,,,,,
2026-07-22 07:00:03,2026-07-22T06:00:03.000,Shepherd Neame Limited,,BOA,Board appointment/change,Board Changes and Trading Update   ,2855N,17699395,,,,,,,
2026-07-22 07:00:03,2026-07-22T06:00:03.000,ProService Building Services Mktplc,PRO,DSH,Director/PDMR shareholding,Purchase of Shares ,2830N,17699394,2,,,,,,
2026-07-22 07:00:03,2026-07-22T06:00:03.000,Boku Inc,BOKU,BOA,Board appointment/change,Appointment of Chief Commercial Officer ,2812N,17699393,99,,,,,,
2026-07-22 07:00:03,2026-07-22T06:00:03.000,Great Southern Copper PLC,GSCU,DRL,Drilling/exploration,Cu-Ag Channel Results Confirm Scale of Monolith ,3718N,17699392,2.4,,,,,,
2026-07-22 07:00:03,2026-07-22T06:00:03.000,FRP Advisory Group PLC,FRP,FR,Final results,Full Year Results ,3051N,17699390,113.5,,,,,,
2026-07-22 07:00:03,2026-07-22T06:00:03.000,Seeing Machines Limited,SEE,UPD,,New European Automotive Program Award ,3402N,17699391,4.56,,,,,,
2026-07-22 07:00:03,2026-07-22T06:00:03.000,Fermi Inc.,FRMI,BOA,Board appointment/change,Departure of Directors or Certain Officers,2980N,17699404,6.62,,,,,,
2026-07-22 07:00:03,2026-07-22T06:00:03.000,Secure Trust Bank PLC,STB,NOR,Notice of results,Notice of Interim Results 2026,2912N,17699420,1556,,,,,,
2026-07-22 07:00:03,2026-07-22T06:00:03.000,Bloomsbury Publishing PLC,BMY,MSC,Miscellaneous,$1.5bn Anthropic Settlement Approved,2911N,17699419,642,,,,,,
2026-07-22 07:00:03,2026-07-22T06:00:03.000,NWF Group PLC,NWF,NOR,Notice of results,Notice of Results and Investor Presentation,2869N,17699418,138.5,,,,,,
2026-07-22 07:00:03,2026-07-22T06:00:03.000,EnSilica PLC,ENSI,MSC,Miscellaneous,Follow on Satellite Orders,2838N,17699417,79,,,,,,
2026-07-22 07:00:03,2026-07-22T06:00:03.000,GCP Asset Backed Income Fund Ltd,GABI,MSC,Miscellaneous,Fourth Compulsory Redemption,2808N,17699416,64.2,,,,,,
2026-07-22 07:00:03,2026-07-22T06:00:03.000,Immupharma PLC,IMM,MSC,Miscellaneous,Thermo Fisher CDMO selected for Kapiglucagon pro,2794N,17699415,4.5,,,,,,
2026-07-22 07:00:03,2026-07-22T06:00:03.000,Zotefoams PLC,ZTF,NOR,Notice of results,Notice of Results & Investor Presentation,2702N,17699414,438,,,,,,
2026-07-22 07:00:03,2026-07-22T06:00:03.000,Poolbeg Pharma PLC,POLB,HOL,Holding(s) in company,Notification of Major Holdings,2974N,17699403,6.2,,,,,,
2026-07-22 07:00:03,2026-07-22T06:00:03.000,Sintana Energy Inc,SEI,NRA,,Shareholder Presentation via Investor Meet Company,2910N,17699428,18.75,,,,,,
2026-07-22 07:00:03,2026-07-22T06:00:03.000,Tungsten West PLC,TUN,DSH,Director/PDMR shareholding,Grant of Awards under Long Term Incentive Plan,3000N,17699407,35.8,,,,,,
2026-07-22 07:00:03,2026-07-22T06:00:03.000,Gem Diamonds Limited,GEMD,NOR,Notice of results,Notification of H1 2026 Trading Update ,6349M,17699413,3.32,,,,,,
2026-07-22 07:00:02,2026-07-22T06:00:02.000,CVC Income & Growth Limited,CVCE,ROI,Result of issue,Result of Placing and WRAP Retail Offer,2900N,17699360,1.085,,,,,,
2026-07-22 07:00:02,2026-07-22T06:00:02.000,Greencoat Renewables PLC,GRP,POS,Change of position,Transaction in Own Shares,2897N,17699359,0.76,,"Greencoat Renewables purchased 271,109 shares for cancellation as part of its March 2026 buyback programme.","On 21 July 2026, Greencoat Renewables repurchased 271,109 ordinary shares on Euronext Dublin at prices ranging from €0.7520 to €0.7720 per share, with a volume-weighted average price of €0.7634. The shares will be cancelled. Following settlement, the company holds 200,000 treasury shares and has 1,082,834,285 shares in issue. The transaction forms part of the buyback programme announced 5 March 2026.",Routine capital management activity; share buybacks typically signal management confidence but are non-events absent specific context around valuation or strategic initiatives.,neutral,https://www.investegate.co.uk/announcement/rns/greencoat-renewables-cdi---grp/transaction-in-own-shares/9680645
2026-07-22 07:00:02,2026-07-22T06:00:02.000,Venture Life Group PLC,VLG,POS,Change of position,Transaction in Own Shares,2896N,17699357,70.0,,"Venture Life repurchases 190,000 shares at 70p per share under existing buyback programme.","Venture Life Group PLC purchased 190,000 ordinary shares on 21 July 2026 at 70 pence per share via Cavendish Capital Markets, to be held as treasury shares. Following the repurchase, the company has 128.86 million shares in issue, with 7.95 million held in treasury, reducing voting rights to 120.91 million shares. The buyback was conducted under the share repurchase programme announced 30 September 2025.",Routine capital management action; modest buyback at consistent price signals orderly execution but provides limited insight into management confidence or strategic direction for this healthcare products company.,neutral,https://www.investegate.co.uk/announcement/rns/venture-life-group--vlg/transaction-in-own-shares/9680644
2026-07-22 07:00:02,2026-07-22T06:00:02.000,AEP Plantations PLC,AEP,POS,Change of position,Transaction in Own Shares,2891N,17699356,170.0,,"AEP Plantations bought 45,977 shares at 164-174p on 21 July under its buyback programme.","AEP Plantations purchased 45,977 ordinary shares on 21 July 2026 at prices ranging from 164p to 174p, with a volume-weighted average price of 167.32p, through Cavendish Capital Markets. Since the buyback programme's announcement on 6 July, the company has acquired 580,292 shares held in treasury. Following this purchase, 383,013,188 voting shares remain in issue, with 16,749,532 shares held in treasury.",Routine share buyback execution within announced programme parameters; ongoing capital return activity with no material news flow or strategic implications for shareholders.,neutral,https://www.investegate.co.uk/announcement/rns/anglo-eastern-plantations--aep/transaction-in-own-shares/9680642
2026-07-22 07:00:02,2026-07-22T06:00:02.000,Science Group PLC,SAG,POS,Change of position,Transaction in Own Shares,2886N,17699353,585,,"Science Group PLC repurchased 10,000 shares at 585p per share on 21 July 2026.","Science Group plc purchased 10,000 ordinary shares on 21 July 2026 at 585 pence per share through Panmure Liberum Limited, representing 0.02% of voting rights. The shares will be held in treasury. Following the purchase, 40,662,593 shares remain in issue (excluding 5,523,281 treasury shares), with the company now holding approximately 12% of issued shares in treasury.","Routine share buyback continuation; modest capital allocation signaling management confidence in valuation, though immaterial scale suggests incremental rather than transformational capital deployment.",neutral,https://www.investegate.co.uk/announcement/rns/science-group--sag/transaction-in-own-shares/9680640
2026-07-22 07:00:02,2026-07-22T06:00:02.000,Pantheon International PLC,PIN,POS,Change of position,Transaction in Own Shares,2878N,17699352,390.0,,"Pantheon International repurchased 295,189 shares at 388-390.5p on 21 July; plans cancellation.","Pantheon International PLC purchased 295,189 ordinary shares on 21 July 2026 via J.P. Morgan Securities at a weighted average price of 389.66 pence per share, spending approximately £1.15m. The shares will be cancelled. Following the transaction, 393,963,764 ordinary shares remain in issue with total voting rights of 393,963,764.",Share buyback with cancellation typically signals management confidence in valuation and returns capital to remaining shareholders; modest buyback size suggests measured capital allocation approach.,positive,https://www.investegate.co.uk/announcement/rns/pantheon-international--pin/transaction-in-own-shares/9680638
2026-07-22 07:00:02,2026-07-22T06:00:02.000,"FirstCash Holdings, Inc.",,LOI,,Update on Letter of Intent ,2876N,17699351,,,,,,,
2026-07-22 07:00:02,2026-07-22T06:00:02.000,Talon Resources PLC,TAR,DRL,Drilling/exploration,High-Grade Gold Confirmed Across Multiple Targets ,2877N,17699350,1.35,,Talon Resources confirms high-grade gold across Eagle Lake targets; maiden drilling planned Q4 2026.,"Talon Resources' Phase 1 exploration at Eagle Lake, Ontario returned strong gold results including 1.85m @ 7.17g/t Au and 4.80m @ 4.47g/t Au at East Fornieri Bay, plus 32.90g/t Au grab sample at Parker Shear. A new Moss Knoll target was identified, with 8.00m @ 0.67g/t Au. Results will be integrated with historical data and machine learning targeting to refine drill targets for a planned 1,000m maiden drilling programme in Q4 2026. The project covers 1,986 hectares with Talon holding a 90% interest.","Early-stage exploration success with visible gold confirmation across multiple targets strengthens pre-drill confidence; Q4 drilling will provide first systematic test of discovery potential, likely supporting positive sentiment for exploration-stage investors.",positive,https://www.investegate.co.uk/announcement/rns/talon-resources-plc--tar/high-grade-gold-confirmed-across-multiple-targets-/9680637
2026-07-22 07:00:02,2026-07-22T06:00:02.000,Gaming Realms PLC,GMR,POS,Change of position,Transaction in Own Shares,2904N,17699361,30.2,,"Gaming Realms repurchased 29,094 shares at 29.90-30.50p as part of ongoing buyback programme.","Gaming Realms PLC purchased 29,094 ordinary shares on 21 July 2026 via Peel Hunt at prices ranging from 29.90p to 30.50p, with a VWAP of 30.13p. The shares will be held in treasury. The company now holds 24,393,381 treasury shares with 271,872,633 shares in issue, representing total voting rights.",Routine share buyback execution within an announced programme; supports capital management but signals no major strategic developments or material news.,neutral,https://www.investegate.co.uk/announcement/rns/gaming-realms--gmr/transaction-in-own-shares/9680647
2026-07-22 07:00:02,2026-07-22T06:00:02.000,Hochschild Mining PLC,HOC,DRL,Drilling/exploration,Production Report for 6 months ended 30 June 2026,2970N,17699380,445.8,,,,,,
2026-07-22 07:00:02,2026-07-22T06:00:02.000,RentGuarantor Holdings PLC,RGG,IOE,Issue of equity,Exercise of Warrants and Total Voting Rights ,2906N,17699363,35.5,,"RentGuarantor exercises 1.08m warrants, raising £189k; share count rises to 149.9m.","RentGuarantor Holdings (AIM: RGG) received notice of warrant exercise for 1,080,000 ordinary shares at 17.5p per share, generating approximately £189,000 in gross proceeds. Following admission to AIM on 23 July 2026, total issued ordinary share capital will be 149,872,459 shares with one voting right each. The company holds no treasury shares.",Routine warrant exercise with modest capital raise; shareholder dilution offset by cash injection; non-event for market.,neutral,https://www.investegate.co.uk/announcement/rns/rentguarantor-holdings-plc--rgg/exercise-of-warrants-and-total-voting-rights-/9680649
2026-07-22 07:00:02,2026-07-22T06:00:02.000,Hardide PLC,HDD,TST,Trading statement,Trading Update,2907N,17699364,74.5,,Hardide trading update shows strong momentum with FY revenues tracking ahead of expectations; £4.5m capacity investment approved.,"Q3 revenues reached £4.1m, bringing nine-month total to £8.9m, ahead of prior guidance. Full-year performance now expected materially ahead of previous expectations (prior guidance: £13.4m revenues, £4.3m EBITDA). Board now confident of doubling revenues in current financial year and more than doubling again within 2-3 years. £4.5m capital investment approved for three new coating reactors operational in latter part of 2027. Company secured ~50% of anticipated 2027 tungsten gas requirements, mitigating input cost inflation.","Strong operational momentum and upgraded guidance with visible investment backing growth ambitions should support positive sentiment, though execution risk on capacity delivery and Middle East/semi-conductor expansion remains.",positive,https://www.investegate.co.uk/announcement/rns/hardide--hdd/trading-update/9680650
2026-07-22 07:00:02,2026-07-22T06:00:02.000,SigmaRoc PLC,SRC,TST,Trading statement,Trading update for the six months to 30 June 2026,2916N,17699365,120.8,,,,,,
2026-07-22 07:00:02,2026-07-22T06:00:02.000,International Workplace Group PLC,IWG,POS,Change of position,Transaction in Own Shares,2913N,17699366,195,,"IWG repurchased 153,656 shares on 21 July as part of ongoing buyback programme; 40.3m shares bought since December 2025.","International Workplace Group plc purchased 153,656 ordinary shares on 21 July 2026 at volume-weighted average price of 1.9462 GBP across multiple venues (LSE, CBOE, Turquoise, Aquis). Since programme launch 31 December 2025, the company has acquired 40,316,339 shares. Post-purchase, 953,972,226 shares remain in issue excluding treasury stock. Shares will be cancelled or held in treasury per shareholder authority from May 2026 AGM.",Routine capital management execution within disclosed authority. Share buybacks can support EPS but market reaction depends on valuation views and broader company fundamentals not addressed here.,neutral,https://www.investegate.co.uk/announcement/rns/iwg--iwg/transaction-in-own-shares/9680651
2026-07-22 07:00:02,2026-07-22T06:00:02.000,Fresnillo PLC,FRES,DRL,Drilling/exploration,Second quarter production report,2917N,17699367,2566,,,,,,
2026-07-22 07:00:02,2026-07-22T06:00:02.000,RIT Capital Partners PLC,RCP,TEN,,Announcement of Tender Price,2918N,17699368,2565,,,,,,
2026-07-22 07:00:02,2026-07-22T06:00:02.000,Experian plc,EXPN,POS,Change of position,Transaction in Own Shares,2920N,17699369,2700.0,,,,,,
2026-07-22 07:00:02,2026-07-22T06:00:02.000,Dialight PLC,DIA,TST,Trading statement,Trading Statement,2921N,17699370,404,,,,,,
2026-07-22 07:00:02,2026-07-22T06:00:02.000,River UK Micro Cap Ltd,RMMC,UPD,,Resignation of Portfolio Manager,2922N,17699371,236,,,,,,
2026-07-22 07:00:02,2026-07-22T06:00:02.000,Wetherspoon (JD) PLC,JDW,TST,Trading statement,Pre-close trading update,2923N,17699372,754,,,,,,
2026-07-22 07:00:02,2026-07-22T06:00:02.000,Ceiba Investments Limited,CBA,TST,Trading statement,Trading Update - Melia ceases operations in Cuba ,2928N,17699373,29,,,,,,
2026-07-22 07:00:02,2026-07-22T06:00:02.000,NAHL Group PLC,NAH,TST,Trading statement,Half Year Trading Update,2929N,17699374,36.2,,,,,,
2026-07-22 07:00:02,2026-07-22T06:00:02.000,InterContinental Hotels Group PLC,IHG,POS,Change of position,Transaction in Own Shares,2936N,17699375,155.55,,,,,,
2026-07-22 07:00:02,2026-07-22T06:00:02.000,Plus500 Limited,PLUS,POS,Change of position,Transaction in Own Shares,2940N,17699376,4078,,,,,,
2026-07-22 07:00:02,2026-07-22T06:00:02.000,Shuka Minerals PLC,SKA,UPD,,Subscription & GMI Loan Update ,2943N,17699377,2.6,,,,,,
2026-07-22 07:00:02,2026-07-22T06:00:02.000,Greencore Group PLC,GNC,TST,Trading statement,Q3 Trading Update,2960N,17699378,221.8,,,,,,
2026-07-22 07:00:02,2026-07-22T06:00:02.000,Energean PLC,ENOG,UPD,,Second Oil Train Boosts Brent-Linked Liquid Output,2963N,17699379,778.5,,,,,,
2026-07-22 07:00:02,2026-07-22T06:00:02.000,Grafton Group PLC,GFTU,POS,Change of position,Transaction in Own Shares,2905N,17699362,945.9,,"Grafton Group purchases 60,000 shares at £9.41 average price as part of £25m buyback programme.","On 21 July 2026, Grafton Group plc repurchased 60,000 ordinary shares at a volume-weighted average price of £9.4124 through Goodbody Stockbrokers on the London Stock Exchange. The shares are being cancelled as part of the £25m buyback programme announced 30 June 2026. To date, 959,172 shares have been purchased in aggregate through Goodbody and Deutsche Bank since programme commencement.",Routine capital management execution; buyback in progress as planned. No material change in direction or strategic significance—standard shareholder return mechanism.,neutral,https://www.investegate.co.uk/announcement/rns/grafton-group-ut-cdi---gftu/transaction-in-own-shares/9680648
2026-07-22 07:00:02,2026-07-22T06:00:02.000,Orosur Mining Inc,OMI,DRL,Drilling/exploration,El Pantano Project Developing ,2989N,17699388,15.4,,,,,,
2026-07-22 07:00:02,2026-07-22T06:00:02.000,Reach PLC,RCH,IR,Interim results,Reach plc Half-year Report,2984N,17699387,59,,,,,,
2026-07-22 07:00:02,2026-07-22T06:00:02.000,Harena Rare Earths PLC,HREE,STR,Strategy/company update,US Government Funding,2985N,17699386,1.925,,,,,,
2026-07-22 07:00:02,2026-07-22T06:00:02.000,AO World plc,AO.,POS,Change of position,Transaction in Own Shares,2975N,17699384,92.9,,,,,,
2026-07-22 07:00:02,2026-07-22T06:00:02.000,Personal Group Holdings PLC,PGH,TST,Trading statement,H1 2026 Trading Update,2982N,17699383,397.5,,,,,,
2026-07-22 07:00:02,2026-07-22T06:00:02.000,Mulberry Group PLC,MUL,FR,Final results,Full Year Results,2972N,17699382,137,,,,,,
2026-07-22 07:00:02,2026-07-22T06:00:02.000,Oriole Resources PLC,ORR,DRL,Drilling/exploration,Completion of Maiden Drilling at Wapouzé,2979N,17699381,0.355,,,,,,
2026-07-22 07:00:02,2026-07-22T06:00:02.000,Boot(Henry) PLC,BOOT,TST,Trading statement,Trading Statement,2995N,17699389,166,,,,,,
2026-07-22 07:00:01,2026-07-22T06:00:01.000,Tristel PLC,TSTL,TST,Trading statement,Positive Trading Update,2766N,17699329,385,,"Tristel posts 10% revenue growth to £51.1m and 14% adjusted PBT growth to £11.5m for FY2026, meeting guidance.","Infection prevention company Tristel delivered FY2026 revenues of £51.1m (up 10% from £46.5m) with adjusted PBT expected at £11.5m (14% growth; FY2025: £10.1m), marginally above market consensus of £11.4m. Adjusted EBITDA margins remained above the 25% target. The company maintained its debt-free status with cash balances of £16.0m (up from £12.8m), supporting overseas expansion. New CEO Chris Lee joins 1 August 2026.",Solid execution on stated targets with double-digit revenue and profit growth and strong cash generation likely supports investor confidence. Ahead of consensus and maintaining margin discipline suggests sustainable business model.,positive,https://www.investegate.co.uk/announcement/rns/tristel--tstl/positive-trading-update/9680616
2026-07-22 07:00:01,2026-07-22T06:00:01.000,Firering Strategic Minerals PLC,FRG,UPD,,Operations and Corporate Update ,2692N,17699330,0.95,,"Firering's Limeco lime project commissions third kiln, transitioning to profitability with 200+ tpd output target.","Firering Strategic Minerals (AIM: FRG) has hot commissioned Kiln 3 at its Limeco quicklime operation in Zambia on 20 July 2026. With three kilns now operational, combined production is expected to exceed 200 tonnes per day, positioning Limeco as one of Zambia's largest high-quality lime producers. Firering increased its stake from 41.7% to 45% following completion of final option payments. The operation is transitioning from breakeven to cash flow positive, expected to be profitable by year-end.","Production ramp-up and margin inflection are material positives, supported by increased ownership stake signalling management confidence. Market likely views this as validation of the Limeco thesis with clear path to earnings contribution.",positive,https://www.investegate.co.uk/announcement/rns/firering-strategic-minerals-di---frg/operations-and-corporate-update-/9680615
2026-07-22 07:00:01,2026-07-22T06:00:01.000,Ariana Resources PLC,AAU,UPD,,Update on Turkish Mining Interests,2792N,17699331,1.55,,"Tavşan mine ramp-up complete at 4,000 tonnes/day; Kiziltepe interests separated for potential sale.","Ariana Resources (9.9% stake in Turkish operator Zenit) reports successful completion of Tavşan mine ramp-up with ore loading at specification rate of 4,000 tonnes daily onto heap-leach pads. Gold recovery maintained at ~70% via ADR circuit with ~350,000 tonnes currently leaching. Recent diamond drilling shows potential pit extensions; 750,000 tonnes ore stockpiled across grades. Kiziltepe sector interests transferred into separate legal entity via in specie distribution to allow independent future transactions; Ariana pursuing sale of its 9.9% Kiziltepe stake to Proccea Construction Co.","Positive operational momentum with Tavşan progressing on schedule and improved processing efficiency, though market impact limited by Ariana's minority stake and complexity of multi-party Turkish transactions.",positive,https://www.investegate.co.uk/announcement/rns/ariana-resources--aau/update-on-turkish-mining-interests/9680618
2026-07-22 07:00:01,2026-07-22T06:00:01.000,Rolls-Royce Holdings plc,RR.,POS,Change of position,Transaction in Own Shares,2658N,17699328,1372.6,,,,,,
2026-07-22 07:00:01,2026-07-22T06:00:01.000,Sirius Real Estate Limited,SRE,ACQ,Acquisition,Sirius completes acquisition for €49.8 million,2673N,17699327,97.3,,Sirius Real Estate completes €49.8m acquisition of fully-let German business park in Fulda with 7.8% yield.,"Sirius Real Estate has completed acquisition of a 57,771 sqm light-industrial business park in Fulda, Germany for €49.8 million. The fully-let asset generates €3.93 million annual rent with 5.1 year weighted average lease expiry and 7.8% EPRA Net Initial Yield. The anchor tenant, a European ballistic protection manufacturer serving military and law enforcement, has occupied the site since 2014 and benefits from structural defence spending growth, including German Armed Forces' MOBAST programme supporting multi-year production visibility.",Positive acquisition signal: attractive 7.8% yield on fully-let asset with government-backed secular demand tailwinds and long-term tenant commitment supports dividend progression prospects.,positive,https://www.investegate.co.uk/announcement/rns/sirius-real-estate-ltd---sre/sirius-completes-acquisition-for-49-8-million/9680614
2026-07-22 07:00:01,2026-07-22T06:00:01.000,Potter & Moore PLC,PAM,ACS,,Posting of FY26 Annual Report and Notice of AGM ,2633N,17699325,23,,Potter & Moore posts FY26 Annual Report and AGM notice; meeting scheduled for 20 August 2026.,"Potter & Moore plc has posted its Annual Report and Accounts for the year ended 31 March 2026 to shareholders, with copies available on its investor website. The company's Annual General Meeting will be held at 11:00 a.m. on Thursday 20 August 2026 at its registered office in Peterborough. The announcement includes contact details for shareholder enquiries and advisers Zeus.",Routine regulatory filing with no material content disclosed; standard corporate governance activity with no operational or financial substance to influence sentiment.,neutral,https://www.investegate.co.uk/announcement/rns/potter-moore-plc--pam/posting-of-fy26-annual-report-and-notice-of-agm-/9680612
2026-07-22 07:00:01,2026-07-22T06:00:01.000,M. P. Evans Group PLC,MPE,UPD,,H1 2026 crop and production ,2494N,17699324,1692,,M.P. Evans reports H1 2026 crop up 14% and CPO production up 11% year-on-year; pricing remains robust.,"M.P. Evans Group harvested 705,400 tonnes of fresh fruit bunches in H1 2026, up 14% from 619,100 tonnes in H1 2025, with own crops rising 13% and scheme-smallholder crops up 15%. CPO production increased 11% to 192,300 tonnes and palm kernels rose 11% to 42,100 tonnes. Mill-gate pricing averaged US$873/tonne for CPO (up from US$868 in H1 2025) and US$813/tonne for PK (up 9% from US$747), demonstrating strong commodity pricing alongside volume growth.","Strong operational performance with double-digit volume growth, improved extraction rates, and robust commodity pricing should support earnings; declining reliance on purchased crops improves margins, signalling positive trajectory for shareholders.",positive,https://www.investegate.co.uk/announcement/rns/m-p-evans-group--mpe/h1-2026-crop-and-production-/9680611
