time_uk,datetime_utc,company,ticker,category_code,category,headline,rns_number,news_id,last_price,pct_change,brief,summary,retail_take,sentiment,source_url
2026-07-22 07:00:00,2026-07-22T06:00:00.000,"Pershing Square Holdings, Ltd.",PSH,POS,Change of position,Transaction in Own Shares,0721773738,17699457,3790.0,,"PSH repurchased 35,360 shares at average $50.68 on 21 July 2026 across LSE venues.","Pershing Square Holdings repurchased 35,360 public shares on 21 July 2026 at an average price of $50.68 USD ($3,788 pence). The buyback comprised 24,047 shares on PSH ticker (average $50.67) and 11,313 on PSHD ticker (average $50.70). NAV per share stood at $77.06 as of 14 July. Post-transaction, PSH has 173.7 million shares outstanding with 37.2 million held in treasury.","Routine share buyback reducing share count at prices below stated NAV, typically supporting per-share value for remaining shareholders; standard capital management for closed-ended funds.",neutral,https://www.investegate.co.uk/announcement/bzw/pershing-square-holdings-ltd--psh/transaction-in-own-shares/9680656
2026-07-22 07:00:00,2026-07-22T06:00:00.000,BlackRock American Income Trust Plc,BRAI,TVR,Total voting rights,Total Voting Rights,60720-0440,17699535,279,,,,,,
2026-07-22 07:00:00,2026-07-22T06:00:00.000,BlackRock Smaller Companies Trust Plc,BRSC,TVR,Total voting rights,Total Voting Rights,60720-0473,17699527,271.5,,,,,,
2026-07-22 07:00:00,2026-07-22T06:00:00.000,Tamar Minerals Plc,,MSCL,,Commencement of Drilling in Cornwall,60721-0772,17699525,,,,,,,
2026-07-22 07:00:00,2026-07-22T06:00:00.000,4basebio Plc,4BB,DSH,Director/PDMR shareholding,Grant of Options & Director/PDMR Dealing,60722-0866,17699520,525,,,,,,
2026-07-22 07:00:00,2026-07-22T06:00:00.000,BlackRock Greater Europe Investment Trust Plc,BRGE,TVR,Total voting rights,Total Voting Rights,60720-0458,17699512,591,,,,,,
2026-07-22 07:00:00,2026-07-22T06:00:00.000,BlackRock Income and Growth Investment Trust Plc,BRIG,TVR,Total voting rights,Total Voting Rights,60720-0386,17699509,230.0,,,,,,
2026-07-22 07:00:00,2026-07-22T06:00:00.000,Cornish Metals,TIN,MSCL,,APPOINTMENT OF NON-EXECUTIVE DIRECTOR,d355c10f4d,17699473,113.5,,"Cornish Metals appoints Andrew Quinn, seasoned mining executive with 50+ years experience, as independent Non-Executive Director.","Andrew Quinn, aged 72, joins Cornish Metals' board effective 22 July 2026 as independent Non-Executive Director and Audit Committee member. Quinn is a chartered engineer and former CIBC mining investment banking head with extensive board experience at ASX-listed Alkane Resources, Barrick Mining, and LBMA. He brings capital markets, M&A and governance expertise as the company advances South Crofty towards production as Europe/North America's first primary tin producer. Quinn holds no current shares in the company.","Positive appointment signalling serious development progress; Quinn's mining pedigree and board-level experience lends credibility during transition to production phase, likely reassuring investors and stakeholders.",positive,https://www.investegate.co.uk/announcement/mfn/cornish-metals-plc--tin/appointment-of-non-executive-director/9680662
2026-07-22 07:00:00,2026-07-22T06:00:00.000,NB Private Equity Partners Limited,NBPE,POS,Change of position,NBPE Announces Transaction in Own Shares,1213787-en,17699456,1432,,"NBPE bought back 100,000 Class A shares on 21 July 2026 at £14.25-£14.38, which will be cancelled.","Neuberger Private Equity Partners Limited repurchased 100,000 Class A Shares on London Stock Exchange on 21 July 2026 at prices between £14.25 and £14.38 per share, pursuant to shareholder authority granted 11 June 2026. All shares will be cancelled, reducing outstanding Class A Shares to 40,514,149 from the previous level. The company also holds 3,150,408 Class A shares in treasury.","Routine capital management activity; share cancellation reduces share count and can support per-share metrics, though modest buyback volume suggests non-event for near-term sentiment.",neutral,https://www.investegate.co.uk/announcement/gnw/neuberger-private-equity-partners-limited--nbpe/nbpe-announces-transaction-in-own-shares/9680659
2026-07-22 07:00:00,2026-07-22T06:00:00.000,Sunbelt Rentals Holdings Inc.,SUNB,MSCL,,"2026 Notice of Annual Meeting of Stockholders, Definitive Proxy Statement and Annual Report to Stockholders",60721-0812,17699537,5226,,,,,,
2026-07-22 07:00:00,2026-07-22T06:00:00.000,Capita,CPI,STR,Strategy/company update,Statement re US Private Placement Notes,b2bb5cbc92,17699472,240.5,,Capita issues $55m US Private Placement Notes at 7.54% coupon for debt refinancing and working capital.,"Capita has issued $55m (£41m net) of unsecured senior notes via US Private Placement with a three-year maturity and 7.54% GBP coupon. Proceeds will refinance existing debt and fund general corporate purposes. The company simultaneously amended its interest cover ratio covenant on existing US Private Placement notes to a 3.0x-3.5x range, aligning with its new revolving credit facility to provide flexibility during its transformation.",Refinancing move signals debt management and liquidity planning; covenant amendment suggests lenders accommodating restructuring efforts. Likely neutral-to-positive as it demonstrates capital market access and improved covenant consistency.,neutral,https://www.investegate.co.uk/announcement/mfn/capita--cpi/statement-re-us-private-placement-notes/9680663
